{
  "manifestVersion": 1,
  "appVersion": "1.0.0",
  "createdAt": "2026-05-07T12:00:00.000Z",
  "nodeId": "example-node",
  "files": [
    {
      "path": "data/leaderboard.json",
      "bytes": 256,
      "sha256": "e3b0c44298fc1c149afbf4c8996fb92427ae41e4649b934ca495991b7852b855",
      "schema": {
        "schemaPath": "data/leaderboard.schema.json",
        "sha256": "0000000000000000000000000000000000000000000000000000000000000000"
      }
    },
    {
      "path": "data/providers/en-US/abc123/en_US.dic",
      "bytes": 1024,
      "sha256": "1111111111111111111111111111111111111111111111111111111111111111",
      "optionalSet": "providers"
    }
  ],
  "optionalSets": [
    "providers"
  ]
}
